{
  "schemaVersion": 2,
  "catalogVersion": "1.5.9",
  "standards": {
    "wstg": "4.2",
    "asvs": "5.0.0-level-2",
    "apiSecurityTop10": "2023",
    "owaspTop10": "2025",
    "cvss": "4.0"
  },
  "threatModel": {
    "deployment": "One club operates one Courtside instance behind the reference proxy with PostgreSQL and server-side sessions.",
    "roles": [
      "ANONYMOUS",
      "MEMBER",
      "TRAINER",
      "SPORT_DIRECTOR",
      "YOUTH_DIRECTOR",
      "GROUNDSKEEPER",
      "TREASURER",
      "ADMIN",
      "COMPROMISED_ACCOUNT"
    ],
    "roleCombinations": [
      [
        "MEMBER",
        "TRAINER"
      ],
      [
        "MEMBER",
        "SPORT_DIRECTOR"
      ],
      [
        "MEMBER",
        "YOUTH_DIRECTOR"
      ],
      [
        "MEMBER",
        "GROUNDSKEEPER"
      ],
      [
        "MEMBER",
        "TREASURER"
      ],
      [
        "MEMBER",
        "ADMIN"
      ]
    ],
    "surfaces": [
      {
        "id": "public-pwa",
        "description": "Public HTML shell, court plan, static assets and PWA lifecycle."
      },
      {
        "id": "authentication",
        "description": "Login, bootstrap, initial password and brute-force controls."
      },
      {
        "id": "session-store",
        "description": "Server-side sessions, CSRF, logout, expiry and credential changes."
      },
      {
        "id": "member-booking",
        "description": "Bookings, series, participants and personal booking data."
      },
      {
        "id": "member-participation",
        "description": "Participant consent, lookup and withdrawal."
      },
      {
        "id": "admin-configuration",
        "description": "Facility, cards, rules and club configuration administration."
      },
      {
        "id": "admin-membership",
        "description": "People, accounts, roles, memberships and membership types."
      },
      {
        "id": "data-exchange",
        "description": "CSV snapshots, previews, external references and full synchronization."
      },
      {
        "id": "rest-api",
        "description": "Contract-first JSON boundary and RFC 9457 error surface."
      },
      {
        "id": "reference-deployment",
        "description": "Caddy, container runtime, network and PostgreSQL topology."
      },
      {
        "id": "release-artifact",
        "description": "Candidate image, dependencies, SBOM, provenance and signature."
      },
      {
        "id": "operations-data",
        "description": "Logs, metrics, backups, restores and retained evidence."
      }
    ],
    "trustBoundaries": [
      {
        "id": "browser-proxy",
        "description": "Untrusted browser and network traffic enters through Caddy."
      },
      {
        "id": "proxy-application",
        "description": "Forwarded identity and transport metadata crosses into Spring Boot."
      },
      {
        "id": "application-database",
        "description": "Application data and server-side sessions enter PostgreSQL."
      },
      {
        "id": "build-artifact",
        "description": "Source and dependencies become a signed container image."
      },
      {
        "id": "operator-evidence",
        "description": "Operational commands create logs, backups and security evidence."
      }
    ]
  },
  "profiles": {
    "safe": {
      "description": "Bounded passive and non-destructive checks that do not alter domain state or exhaust resources.",
      "allowedEnvironments": [
        "SECURITY",
        "UAT",
        "EXPLICIT_PRODUCTION"
      ],
      "productionAllowed": true,
      "productionRequiresExplicitAuthorization": true,
      "requiresExplicitAuthorization": false,
      "prohibitedActions": [
        "domain mutation",
        "credential guessing",
        "resource exhaustion",
        "foreign-origin discovery"
      ]
    },
    "active": {
      "description": "Curated authentication, authorization, mutation and injection attacks against a disposable target.",
      "allowedEnvironments": [
        "SECURITY"
      ],
      "productionAllowed": false,
      "productionRequiresExplicitAuthorization": true,
      "requiresExplicitAuthorization": true,
      "prohibitedActions": [
        "volumetric denial of service",
        "foreign-origin callbacks",
        "unbounded payload generation"
      ]
    },
    "destructive": {
      "description": "Bounded exhaustion and protocol-abuse checks that may make the disposable target unavailable.",
      "allowedEnvironments": [
        "SECURITY"
      ],
      "productionAllowed": false,
      "productionRequiresExplicitAuthorization": true,
      "requiresExplicitAuthorization": true,
      "prohibitedActions": [
        "public targets",
        "unbounded concurrency",
        "traffic outside circuit-breaker budgets"
      ]
    }
  },
  "outcomes": {
    "passed": {
      "description": "Every selected control executed with complete evidence and no unaccepted validated finding.",
      "releaseEligible": true
    },
    "incomplete": {
      "description": "A tool, prerequisite, target proof, control or required evidence is missing or failed to execute.",
      "releaseEligible": false
    },
    "failed": {
      "description": "A secure outcome was violated or a validated finding remains outside an unexpired acceptance.",
      "releaseEligible": false
    }
  },
  "severity": [
    {
      "level": "P0",
      "cvssMinimum": 9.0,
      "triageWithinHours": 24,
      "releasePolicy": "Blocks release until fixed and retested."
    },
    {
      "level": "P1",
      "cvssMinimum": 7.0,
      "triageWithinHours": 72,
      "releasePolicy": "Blocks release unless an explicit unexpired acceptance records compensating controls."
    },
    {
      "level": "P2",
      "cvssMinimum": 4.0,
      "triageWithinHours": 336,
      "releasePolicy": "Requires an owned remediation or time-bounded acceptance."
    },
    {
      "level": "P3",
      "cvssMinimum": 0.0,
      "triageWithinHours": 720,
      "releasePolicy": "Recorded and prioritized with product context."
    }
  ],
  "governance": {
    "singleMaintainerMayApprove": true,
    "independentReviewRecorded": true,
    "missingIndependentReviewBlocks": false,
    "privateFindingChannel": "GitHub private vulnerability reporting"
  },
  "controlCoverage": [
    {
      "standard": "asvs",
      "version": "5.0.0-level-2",
      "source": "https://github.com/OWASP/ASVS/blob/936f29673daa69fe90e6fa706011f89aef201988/5.0/docs_en/OWASP_Application_Security_Verification_Standard_5.0.0_en.flat.json",
      "sourceCommit": "936f29673daa69fe90e6fa706011f89aef201988",
      "controls": [
        {
          "id": "v5.0.0-1.1.1",
          "status": "implemented",
          "manualProcedureId": "MAN-INPUT-001",
          "controlEvidence": {
            "productionPath": "src/main/java/org/courtside/dataexchange/internal/SnapshotParser.java",
            "falsifyingTest": "src/test/java/org/courtside/dataexchange/SnapshotParserTest.java#givenPercentEncodedText_whenParsing_thenItIsNotDecodedAsAnotherInputLayer"
          }
        },
        {
          "id": "v5.0.0-1.1.2",
          "status": "implemented",
          "manualProcedureId": "MAN-INPUT-001",
          "controlEvidence": {
            "productionPath": "frontend/src/views/AdminAuditView.tsx",
            "falsifyingTest": "frontend/e2e/browser-security.spec.ts#stored text projections remain inert on administrative and managed views"
          }
        },
        {
          "id": "v5.0.0-1.2.1",
          "status": "implemented",
          "assessmentTestIds": [
            "CSA-PWA-001"
          ]
        },
        {
          "id": "v5.0.0-1.2.2",
          "status": "implemented",
          "manualProcedureId": "MAN-INPUT-001",
          "controlEvidence": {
            "productionPath": "frontend/src/App.tsx",
            "falsifyingTest": "frontend/e2e/browser-security.spec.ts#URL configuration rejects active schemes and renders accepted relative targets"
          }
        },
        {
          "id": "v5.0.0-1.2.3",
          "status": "implemented",
          "manualProcedureId": "MAN-INPUT-001",
          "controlEvidence": {
            "productionPath": "src/main/java/org/courtside/audit/web/AuditAdminController.java",
            "falsifyingTest": "frontend/e2e/browser-security.spec.ts#stored text projections remain inert on administrative and managed views"
          }
        },
        {
          "id": "v5.0.0-1.2.4",
          "status": "implemented",
          "manualProcedureId": "MAN-INPUT-001",
          "controlEvidence": {
            "productionPath": "src/main/java/org/courtside/member/MemberRepository.java",
            "falsifyingTest": "src/test/java/org/courtside/member/web/ParticipantMemberControllerTest.java#givenSqlSyntax_whenSearchingMembers_thenItRemainsALiteralNameFragment"
          }
        },
        {
          "id": "v5.0.0-1.2.5",
          "status": "not-applicable",
          "manualProcedureId": "MAN-INPUT-001",
          "rationale": "The control asks for parameterized operating-system calls or contextual command-line encoding. The shipped application starts no operating-system process at all: it constructs no ProcessBuilder and calls no Runtime.getRuntime, so no request value ever reaches a command line. InterpreterSurfaceTest#whenReadingTheShippedSource_thenNoInterpreterIsThereForAnInjectionToReach goes red the moment one appears in src/main/java."
        },
        {
          "id": "v5.0.0-1.2.6",
          "status": "not-applicable",
          "manualProcedureId": "MAN-INPUT-001",